{
 "record_id": "RTPU2442",
 "schema_version": "0.1",
 "entities": {
  "brand_id": "unresolved:풀무원",
  "space_id": "unresolved:성수_연무장17길7_토로토로스튜디오",
  "client_party_id": "unresolved:프레인글로벌",
  "brand_key": "풀무원",
  "space_key": "성수_토로토로스튜디오"
 },
 "intervention": {
  "concept": "'맛탐정' 세계관을 활용한 풀무원더랜드 체험형 팝업스토어. 인트로/리워드존, 미션 체험존, 포토부스로 구성되며 탐정 유니폼 스탭과 서재·비디오 판독실·사격 훈련장 등 존별 미션을 운영한다. 시식(육포·시퐁케이크)과 샵풀무원/카카오톡 채널 가입 리워드를 제공했다.",
  "brand_name": "풀무원더랜드",
  "experience_elements": [
   "인트로/리워드존",
   "미션 체험존",
   "포토부스",
   "서재 존(풀무타임즈, MBTI 질문)",
   "비디오 판독실(수사보드)",
   "사격 훈련장(과녁 게임기)",
   "맛탐정 KIT",
   "시식(육포 2종, 시퐁케이크 2종)",
   "탐정 유니폼 스탭"
  ],
  "promotions": [
   "샵풀무원 가입 리워드",
   "카카오톡 채널 친구추가 리워드",
   "스크래치 금액권 쿠폰",
   "미션 완수 키트 지급"
  ],
  "staging_tags": [
   "탐정 컨셉",
   "맛탐정 세계관",
   "포토존",
   "미술관 액자",
   "벽난로/무전기 소품",
   "머그샷"
  ],
  "attributes": {
   "host_daily_traffic": null,
   "plan_visitors_per_day": null,
   "capacity_per_session": null,
   "giveaway_qty": null,
   "area_sqm": null,
   "planned_operating_days": 7,
   "throughput_units": null,
   "unit_minutes": null,
   "operating_hours_per_day": null,
   "staff_count": null,
   "experience_density": 4,
   "goods_scale": 1,
   "photo_zones": 2,
   "collab_strength": 0,
   "ip_awareness": 2,
   "target_breadth": 3,
   "entry_friction": 1,
   "media_push": 2,
   "season_fit": 2,
   "venue_prominence": 2
  },
  "attr_meta": {
   "evidence": "계약서 제2조③ '행사일 2024년 10월 22일(화)~10월 28일(월) (세팅 10/21 / 철수 10/29)' → 순 운영 7일. 계약서 2건 동일본. 제안서 내용 공란, 인원·수량 수치 전무.",
   "confidence": "medium",
   "range_dropped": null,
   "tagger": "T1c (2026-07-28) 사전문서 층화선별"
  }
 },
 "conditions": {
  "location": {
   "city": "서울",
   "district": "성동구",
   "venue_name": "토로토로 스튜디오(토로토로 성수)",
   "venue_type": "팝업 스튜디오",
   "foot_traffic_context": "성수 연무장길, 역에서 다소 거리가 있음(정성 평가 언급)"
  },
  "area_pyeong": null,
  "period": {
   "from": "2024-10-22",
   "to": "2024-10-28",
   "days": 7
  },
  "season": "가을",
  "fee_structure": {
   "type": "agency_fee",
   "detail": "총 계약금액 100,000,000원(VAT 별도). 운영대행 용역. 선금 50% 50,000,000원 2024-09-30 지급, 잔금 50% 50,000,000원 2024-11-22 지급. 지급처 프레인글로벌."
  },
  "brand_requirements": [
   "제작물 사용 전 의뢰사 감수 필수",
   "모든 제작물 지식재산권 의뢰사 귀속",
   "지식재산권 사용 가이드라인 준수",
   "진행 보고서 제출",
   "안전보건관리 및 사고방지",
   "비밀유지"
  ],
  "scale": {
   "store_count": 1,
   "venue_traffic_type": "standalone",
   "host_traffic_note": "성수 연무장길, 역에서 다소 거리가 있음(정성 평가 언급)"
  },
  "derived": {
   "duration": {
    "days": 7,
    "weekend_share": 0.29,
    "holiday_days": 0
   },
   "ip_history": {
    "prior_count": 0,
    "months_since_last": null,
    "first_edition": true
   },
   "calendar": {
    "holiday_since": 34,
    "holiday_until": 95,
    "holiday_block_in": 0,
    "nat_event_gap": 23,
    "nat_event": null,
    "doc_lag_days": 46,
    "doc_dates_found": 2
   },
   "competition": {
    "comp_same_addr_open": 0,
    "comp_prior_at_venue": 0,
    "comp_within_500m_open": 0,
    "comp_within_1000m_open": 0,
    "matched_address": null
   },
   "pnl_pre": {
    "pnl_pre_total": 6886148.0,
    "pnl_pre_accounts": 4,
    "pnl_pre_months": 2,
    "pnl_pre_first": "2024-08-01"
   }
  },
  "venue_knowledge": {
   "venue_daily_footfall": 400,
   "popup_zone_pass_rate": 0.75,
   "host_traffic_est": 300.0,
   "venue_scale_tier": 5,
   "confidence": "low",
   "source": "T1b 세계지식 태거(2026-07-28) — 장소만 질의, 팝업 정보 미제공"
  }
 },
 "outcome": {
  "daily": [
   {
    "date": "2024-10-22",
    "visitors": 309,
    "sales_krw": null
   },
   {
    "date": "2024-10-23",
    "visitors": 645,
    "sales_krw": 108995
   },
   {
    "date": "2024-10-24",
    "visitors": 705,
    "sales_krw": 358725
   },
   {
    "date": "2024-10-25",
    "visitors": 810,
    "sales_krw": 515303
   },
   {
    "date": "2024-10-26",
    "visitors": 1010,
    "sales_krw": 143070
   },
   {
    "date": "2024-10-27",
    "visitors": 962,
    "sales_krw": 402240
   },
   {
    "date": "2024-10-28",
    "visitors": 595,
    "sales_krw": 674940
   }
  ],
  "totals": {
   "visitors": 5036,
   "sales_krw": 2203273,
   "rev_mm_recognized": 159.4
  },
  "counting_method": "entry",
  "counting_basis": "세부내역 표의 '방문객' 및 '방문객 입장' 컬럼 기준(일자별 방문객 수). 별도로 시식 참여 3,570, 미션 참여 4,637, 리워드 가입 등 참여 지표가 분리 집계됨.",
  "plan_visitors_expected": null,
  "retention": null,
  "source": "visitors/sales: 결과보고서 LLM 추출(목표 KPI 총 2,160명(일별 260~370) 대비 방문객 5,036명으로 달성률 233%. 매출(결제 금액) 합계 2,203,273원은 쿠폰 사용 실적 기반 POS 결제 금액. KPI는 목표치이며 별도 '예상 방문' 수치는 문서에 없음.). rev_mm: ods.amaranth_project_pnl 매출액 합산 스냅샷(2026-05 마감분까지) — 진행 중 프로젝트는 부분 인식일 수 있음, 계약 총액은 fee_structure.detail 참조",
  "rev_mm_completion": {
   "status": "complete",
   "rule": "운영종료 2024-10, 스냅샷까지 2개월+ (시간 규칙)",
   "contract_total_mm": 100.0,
   "last_recognition_period": "2024-10"
  },
  "label_trust": {
   "grade": "A",
   "flags": [],
   "why": "일별 표가 기간의 100% 커버"
  },
  "label_scope": {
   "label_from": "2024-10-22",
   "label_to": "2024-10-28",
   "label_active_days": 7,
   "label_span_days": 7,
   "label_contiguous": true,
   "daily_sum": 5036,
   "sum_agrees": true,
   "source": "daily 일자에서 유도 — 합이 총계와 일치"
  }
 },
 "docs": [
  {
   "doc_id": "1OEUc5QmyViOgIB6tPrf7rArs1A4fur2Z",
   "kind": "운영일지",
   "uri": "https://drive.google.com/file/d/1OEUc5QmyViOgIB6tPrf7rArs1A4fur2Z/view",
   "title": "[Sweetspot] 풀무원 팝업스토어_결과보고서_241030.pdf"
  },
  {
   "doc_id": "1Q7tbrIXfk72CcQbGvRq78tkU9Gkx9LJA",
   "kind": "계약서",
   "uri": "https://drive.google.com/file/d/1Q7tbrIXfk72CcQbGvRq78tkU9Gkx9LJA/view",
   "title": "RTPU2442_프레인_2024년풀무원더랜드팝업스토어_계약서_240904.pdf"
  },
  {
   "doc_id": "1SxhHHp1sUTAu0Lob8Yr5cHQ4AubqGxVn",
   "kind": "계약서",
   "uri": "https://drive.google.com/file/d/1SxhHHp1sUTAu0Lob8Yr5cHQ4AubqGxVn/view",
   "title": "[전자]풀무원_[Sweetspot]_업무계약서_2024년풀무원더랜드팝업스토어(240906).pdf"
  },
  {
   "doc_id": "1TWgEnCcTQOnf_xfgOmLu6n3ac0jJHwxho6nwemJdk6s",
   "kind": "기획서",
   "uri": "https://drive.google.com/file/d/1TWgEnCcTQOnf_xfgOmLu6n3ac0jJHwxho6nwemJdk6s/view",
   "title": "제안서_내용없음"
  },
  {
   "doc_id": "1_-L9kFjrOGodDO4_e0fSgkuS6oYRpTQ1",
   "kind": "기타",
   "uri": "https://drive.google.com/file/d/1_-L9kFjrOGodDO4_e0fSgkuS6oYRpTQ1/view",
   "title": "(Sweetspot)F&B 팝업스토어_예산안_11차_241029_견적서.pdf"
  }
 ],
 "provenance": {
  "extracted_by": "llm:claude-opus-4-8(bulk-ingest)",
  "reviewed_by": "미검수 — 뱅크 확장 우선 투입(2026-07-23), 정식 검수 대기",
  "extracted_at": "2026-07-23",
  "notes": "일괄 정규화. confidence=high. 완독 문서 4건: RTPU2442_프레인_2024년풀무원더랜드팝업스토어_, [전자]풀무원_[Sweetspot]_업무계약서_2024, 제안서_내용없음, [Sweetspot] 풀무원 팝업스토어_결과보고서_24. 미확실: area_pyeong(면적) 정보 없음; 기획서/제안서 원문 비어있어 plan_visitors_expected 확인 불가; 10/22 매출 데이터 없음(-); client_name 프로젝트 메타에는 null이나 계약서상 의뢰사는 프레인글로벌(실제 브랜드는 풀무원)"
 }
}